coordinates,created_at,hashtags,media,urls,favorite_count,id,in_reply_to_screen_name,in_reply_to_status_id,in_reply_to_user_id,lang,place,possibly_sensitive,retweet_count,retweet_id,retweet_screen_name,source,text,tweet_url,user_created_at,user_screen_name,user_default_profile_image,user_description,user_favourites_count,user_followers_count,user_friends_count,user_listed_count,user_location,user_name,user_screen_name,user_statuses_count,user_time_zone,user_urls,user_verified
,Fri Apr 17 06:52:03 +0000 2020,,,https://twitter.com/MSNBC/status/1251027874792050688,0,1251040711023214592,,,,en,,false,0,,,"<a href=""http://twitter.com/download/iphone"" rel=""nofollow"">Twitter for iPhone</a>",Take a lesson from this when you’re upset about your freedom and you think COVID-19 is “just like the flu” https://t.co/lkx5iraYaP,https://twitter.com/lnbeattie292/status/1251040711023214592,Fri Jun 28 13:58:58 +0000 2019,lnbeattie292,false,"Mom, wife, avid reader,🩸♥️ liberal, Trump hater, lover of music, movies & literature, lifetime student",594,32,167,0,"North Carolina, USA",Ellen Beattie,lnbeattie292,421,,,false
,Thu Apr 16 23:58:10 +0000 2020,Covid_19 Coronavirus,,https://www.thenewatlantis.com/publications/not-like-the-flu-not-like-car-crashes-not-like,1,1250936554002034691,,,,en,,false,0,,,"<a href=""http://twitter.com/download/iphone"" rel=""nofollow"">Twitter for iPhone</a>","In case there is anyone out there still saying #Covid_19 is ""just like the flu"" etc. and/or is failing to understand why stay at home orders are still necessary for the time being.

Please check out this article and the attached graph:
https://t.co/r1AzOIqrKq
#Coronavirus",https://twitter.com/PeterBKelly25/status/1250936554002034691,Wed Jan 25 15:47:51 +0000 2012,PeterBKelly25,false,"Advertiser, Actor and Adventurer living near The Third Coast.",6215,202,757,6,Chicago,Peter Brian Kelly,PeterBKelly25,2191,,,false
,Wed Apr 15 08:53:33 +0000 2020,,,https://twitter.com/ryanstruyk/status/1250253717741469698,3,1250346513374429185,,,,en,,false,0,,,"<a href=""http://twitter.com/download/iphone"" rel=""nofollow"">Twitter for iPhone</a>",When people say COVID-19 is just like the flu and not that bad..... https://t.co/URoa8SR223,https://twitter.com/CedSaidwhat/status/1250346513374429185,Mon Dec 27 19:43:13 +0000 2010,CedSaidwhat,false,"Research Data Analyst. MBA in Information Systems. Healthcare, Analytics and Politics. Obsessed with data and traveling. Views and opinions my own",30586,349,606,1,"Nashville, TN",Cedric Duncan,CedSaidwhat,4875,,,false
,Wed Apr 15 13:56:36 +0000 2020,Covid_19,,,0,1250422776977969152,KorabekTim,1250420134612738000,926078095467171800,en,,,0,,,"<a href=""http://twitter.com/download/iphone"" rel=""nofollow"">Twitter for iPhone</a>","@KorabekTim @LouDobbs @realDonaldTrump Start by holding you own accountable 

Trump lied to the American ppl when he said it was a hoax/ #Covid_19 is just like the flu he said knowing it wasn’t true causing his own supporters to ignore social distancing and DIE

🩸Trump LIED 

Will you hold him accountable ?",https://twitter.com/too2_i/status/1250422776977969152,Thu Oct 03 12:22:24 +0000 2019,too2_i,false,"The GOP is the American version of Russian Oligarchs, don’t ever Trust them. They don’t hav the U.S best interests @ heart. They only care about power #BLM✊🏽",16850,1012,2445,3,,BirdyBlue🆘,too2_i,23490,,,false
,Thu Apr 23 22:02:02 +0000 2020,,,,3,1253444042097975296,OFemmeFataleZ,1253432153490124800,1003644268756512800,en,,,1,,,"<a href=""http://twitter.com/#!/download/ipad"" rel=""nofollow"">Twitter for iPad</a>",@OFemmeFataleZ @PalmerReport But conservatives tell me Covid-19 is just like the flu,https://twitter.com/IamIamkidt/status/1253444042097975296,Sun May 03 04:18:57 +0000 2015,IamIamkidt,false,most likely in Twitter jail.  sometimes I swear,54350,1085,3794,0,Inside your head,Kid T,IamIamkidt,22397,,,false
,Wed Apr 29 18:45:39 +0000 2020,,,,1,1255568949862957057,,,,en,,,0,,,"<a href=""http://twitter.com/download/android"" rel=""nofollow"">Twitter for Android</a>","There are still dumb bitches that think COVID-19 is just like the flu.

Wow",https://twitter.com/xoxo_juliax3/status/1255568949862957057,Fri Mar 15 00:08:29 +0000 2013,xoxo_juliax3,false,We must be the change we want to see in the world (she/her),12858,137,119,0,,i hate it here,xoxo_juliax3,10277,,https://youtu.be/ltun92DfnPY,false
,Fri Apr 17 20:23:53 +0000 2020,,,,0,1251245017395613696,,,,en,,,0,,,"<a href=""http://twitter.com/download/android"" rel=""nofollow"">Twitter for Android</a>","@StokedTweeter Spot on. Covid - 19 is just like the flu. Fu*k it. Acceptable losses. Yay, Pres. Trump. The protestors in Michigan with Confederate, Nazi and Trump flags rock!",https://twitter.com/CincinnatiJames/status/1251245017395613696,Wed Dec 10 18:22:33 +0000 2008,CincinnatiJames,false,"Business person, writer, actor, script development, web, licensed Sports Detective.",879,47,134,3,Los Angeles,CincinnatiJames,CincinnatiJames,1460,,,false
,Wed Apr 29 22:48:45 +0000 2020,,,,1,1255630129000099840,LeilaniMunter,1255524108915347500,15650636,en,,,0,,,"<a href=""http://twitter.com/download/iphone"" rel=""nofollow"">Twitter for iPhone</a>","@LeilaniMunter Covid-19 IS just like the flu. Both are viruses, both can make you feel miserable, one you are generally better after a few days to a week....the other has a good chance of making you win your bet with the life insurance company....",https://twitter.com/twitnit54/status/1255630129000099840,Sat Jul 03 15:18:57 +0000 2010,twitnit54,false,"Family, friends, comedy and well done sarcasm (as opposed to medium rare) are important to me.",647,20,112,0,"Scottsdale, AZ",Sunny Daze,twitnit54,791,,,false
,Thu Apr 16 19:30:18 +0000 2020,,,https://twitter.com/HistoryDavidson/status/1250864511751421955,3,1250869141562482688,,,,en,,false,0,,,"<a href=""http://twitter.com/download/android"" rel=""nofollow"">Twitter for Android</a>","Critics of social distancing and restrictions who say COVID-19 ""is *just* like the flu"" to minimize the seriosuness of our current public health crisis don't understand virology *or* history. People who understand 1918 don't minimize the devastation caused by the flu. https://t.co/1TrEfe7HLN",https://twitter.com/RoseStremlau/status/1250869141562482688,Fri May 30 02:56:16 +0000 2014,RoseStremlau,false,Historian. Author. Educator. Professor. Great Pyr rescuer. Views are my own.,70356,1173,853,15,"Davidson, NC",Dr. Rose Stremlau,RoseStremlau,2270,,,false
,Thu Apr 23 03:02:35 +0000 2020,IsAMassiveUnderstatement,,,3,1253157289587929089,,,,en,,,0,,,"<a href=""http://twitter.com/download/android"" rel=""nofollow"">Twitter for Android</a>",Saying covid-19 is just like the flu #IsAMassiveUnderstatement,https://twitter.com/SanjiTill/status/1253157289587929089,Sun Nov 04 19:06:20 +0000 2012,SanjiTill,false,98% Chimpanzee,1917,2170,4469,3,Canada,Sanji Till,SanjiTill,2787,,,false
,Wed Apr 29 15:58:07 +0000 2020,,,,1,1255526790149353472,JessicaTarlov,1255508622622298000,3056746427,en,,,0,,,"<a href=""https://mobile.twitter.com"" rel=""nofollow"">Twitter Web App</a>","@JessicaTarlov @OutnumberedFNC Jessica, speaking as a right-winger, if I hear one more fellow right-winger say covid-19 is just like the flu, I'm going to take hostages. Please mention that",https://twitter.com/bogritz/status/1255526790149353472,Fri Jul 09 13:32:18 +0000 2010,bogritz,false,"Just a guy.  Disabled Vet Dealing with day-to-day life, one hour at a time.
Vegan strong.",9102,130,309,1,My,Bo Gritz ( not THAT Bo Gritz) Ⓥ,bogritz,6922,,http://Nobodygivesashitaboutyourproblemssojustgetoveritandgetonwithit.com,false
,Tue Apr 14 07:24:32 +0000 2020,,,,9,1249961723282501635,VK_Cast,1249941169498448000,1837595587,en,,,0,,,"<a href=""http://twitter.com/download/iphone"" rel=""nofollow"">Twitter for iPhone</a>",@VK_Cast @Victor__Newman @MarthaW19860146 @parkbench559 @atlpt1870 @Howlinghamster @Khalid_Hart @maggieNYT And Covid-19 is just like the flu. Trump said so.,https://twitter.com/mirandabanana/status/1249961723282501635,Mon Nov 03 22:12:49 +0000 2008,mirandabanana,false,"Recovering ad exec, former journalist, and one-time crop duster. Voted in every election in which I've been eligible. Current @juliemason fangirl.",14068,165,223,3,"Austin, TX",Miranda Banana,mirandabanana,9904,,,false
,Wed Apr 15 11:24:19 +0000 2020,,,,1,1250384452448108544,MozScott,1250335669609566200,959744803448770600,en,,,0,,,"<a href=""http://twitter.com/download/android"" rel=""nofollow"">Twitter for Android</a>",@MozScott @JLPerchard @WHO There are also those in the US who said COVID-19 is just like the flu. The @WHO isn't perfect (which international body is?) but as US cases rocket past the rest of the world Trump is clearly looking for scapegoats to shore up his bid for a second term.,https://twitter.com/mailolstar/status/1250384452448108544,Sun Mar 15 08:15:30 +0000 2015,mailolstar,false,"'Socially irresponsible' intermittent @JEPnews columnist, works in Compliance. 
Founder of @9x5Media
Views my own and not my employer's. https://t.co/I66dB9NZ5t",23991,1267,1298,36,Saint Helier,Ollie Taylor,mailolstar,19763,,http://www.9x5Media.com,false
,Wed Apr 08 23:02:06 +0000 2020,,,https://trib.al/yJWYm0T,0,1248023340192804875,,,,en,,false,1,,,"<a href=""http://www.socialflow.com"" rel=""nofollow"">SocialFlow</a>",Daily News |  Do you still think COVID-19 is just like the flu? | Coronavirus Newsletter https://t.co/S8VUVcueCr,https://twitter.com/PhillyDailyNews/status/1248023340192804875,Wed May 07 17:36:54 +0000 2008,PhillyDailyNews,false,"The Daily News is an edition of The Philadelphia Inquirer, in operation since 1925. Find us online at https://t.co/RKhpvmquMM",722,179190,732,1879,"Philadelphia, PA, US",Philly Daily News,PhillyDailyNews,147918,,http://www.inquirer.com,true
,Mon Mar 30 22:47:10 +0000 2020,,,,0,1244758091096158208,Redeyebronson,1244755287879430100,813911665427157000,en,,,0,,,"<a href=""https://mobile.twitter.com"" rel=""nofollow"">Twitter Web App</a>","@Redeyebronson @SebGorka @realDonaldTrump He made the correct call banning travel from China at the end of January. Whereupon you people attacked him because ""COVID-19 is just like the flu"".
He called it right on chloroquine, which has been approved in France and by the FDA.
Even the Democrats agree his North American",https://twitter.com/Freman67/status/1244758091096158208,Sun May 21 09:24:46 +0000 2017,Freman67,false,"""Gee, Brain. What are we going to do tonight?""
""The same thing we do every night, Pinky. Try to take over the world.""",41764,676,4732,3,New Zealand,Jason,Freman67,23847,,,false
,Sat Apr 11 05:52:01 +0000 2020,,,,5,1248851277062082561,kjkwinger6,1248820835613278200,58047236,en,,,0,,,"<a href=""http://twitter.com/download/iphone"" rel=""nofollow"">Twitter for iPhone</a>","@kjkwinger6 @emhlung @kmattox1 For anyone who still thinks COVID-19 is “just like the flu”, let this sink in",https://twitter.com/Clavikul/status/1248851277062082561,Mon Dec 05 09:09:38 +0000 2011,Clavikul,false,"Thoracic Surgeon, Research Lead in Lung Cancer at Victorian Comprehensive Cancer Centre, Director of Surgical Oncology at St Vincent's Hospital, Wurundjeri land",8985,978,748,18,Melbourne,A/Prof Gavin Wright,Clavikul,7027,,http://www.emhl.com.au,false
,Sat Mar 28 01:02:46 +0000 2020,,,,2,1243705054105755650,,,,en,,,0,,,"<a href=""http://twitter.com/download/iphone"" rel=""nofollow"">Twitter for iPhone</a>","For anyone that says the Covid-19 is just like the flu:

 600 people don’t die from the flu in a single week in New York City.",https://twitter.com/SheilaDRead/status/1243705054105755650,Fri Oct 14 20:57:16 +0000 2011,SheilaDRead,false,I laugh and vent politically here.,23169,206,823,1,"San Francisco, Ca ",S.D.Read,SheilaDRead,4179,,,false
,Fri Mar 27 03:47:53 +0000 2020,,,https://twitter.com/dust_mill/status/1243274105962577921,1,1243384220845608961,,,,en,,false,0,,,"<a href=""https://mobile.twitter.com"" rel=""nofollow"">Twitter Web App</a>","How could HE have a cure? He's wilfully ignorant and still keeps saying that COVID-19 is 'just like the flu."" If any scientist(s) come up with a cure, they won't save it for Trump to announce! https://t.co/0nU1vJwyi4",https://twitter.com/VHodgeAuthor/status/1243384220845608961,Fri Mar 18 18:04:50 +0000 2016,VHodgeAuthor,false,"Writer of classic #Regency romances, also #Trekker, aspiring #globetrotter, lover of good food, hot toddies, cool fog.",29455,497,428,60,"San Francisco, CA",Victoria Hodge,VHodgeAuthor,82392,,,false
,Fri Apr 10 09:50:20 +0000 2020,,,https://twitter.com/MaxCRoser/status/1247884285333266434?s=19,0,1248548862022819842,JohnFiliss,1248297584030036000,314739157,en,,false,0,,,"<a href=""http://twitter.com/download/android"" rel=""nofollow"">Twitter for Android</a>","@JohnFiliss @OffGuardian0 @Sideshow_JaneV3 @MoonofA Still claiming Covid-19 is just like the flu? Facts are such a pain aren't they.
https://t.co/v4EBUkqknZ",https://twitter.com/TheSiuloir/status/1248548862022819842,Wed Mar 10 20:54:32 +0000 2010,TheSiuloir,false,Who needs a label?,29563,244,904,1,Ireland,Andy Walker,TheSiuloir,7545,,,false
,Wed Apr 08 05:38:43 +0000 2020,,,https://www.youtube.com/watch?v=FVIGhz3uwuQ,0,1247760767853588481,,,,en,,false,0,,,"<a href=""http://twitter.com/download/iphone"" rel=""nofollow"">Twitter for iPhone</a>",If you are one of those people who believe that COVID-19 is “just like the flu” then this video is for you. Please watch.  https://t.co/PaQsMer3ug,https://twitter.com/blitzkriegbauer/status/1247760767853588481,Thu Nov 24 00:58:28 +0000 2016,blitzkriegbauer,false,Emotional support Canadian 🇨🇦. Stand-up and sitcom enthusiast. I speak my mind. No DMs. #AnimalRights #MMIW #BLM #ClimateAction,95254,3511,3380,2,"Ontario, Canada",Megan Bauer,blitzkriegbauer,17310,,,false
,Thu Apr 02 15:36:48 +0000 2020,,,,3,1245736953108213762,bencar123,1245694331790426000,43995875,en,,,0,,,"<a href=""https://mobile.twitter.com"" rel=""nofollow"">Twitter Web App</a>","@bencar123 @coasttocoastam GN's been spreading dangerous trumpian lies the ""covid-19 is just like the flu!""- I hope he gets investigated for manslaughter for all these ppl dying",https://twitter.com/ThmsHoward/status/1245736953108213762,Thu Aug 31 02:55:34 +0000 2017,ThmsHoward,false,"#BLM- mandatory Liability Insurance for police- 45 is evil, his followers just as bad-  SCOTUS is constrained by NO ethics rules!- Restore Jackie's Rose Garden-",112200,1255,792,4,,"Thomas ""Trump is a SORE LOSER"" Howard",ThmsHoward,58854,,,false
,Thu Apr 02 15:33:44 +0000 2020,,,,0,1245736180718673920,BajatosPoppa,1245421942464798700,1219017629412790300,en,,,0,,,"<a href=""https://mobile.twitter.com"" rel=""nofollow"">Twitter Web App</a>","@BajatosPoppa @mmfa he's been spreading dangerous trumpian lies the ""covid-19 is just like the flu!""- I hope he gets investigated for manslaughter for all these ppl dying",https://twitter.com/ThmsHoward/status/1245736180718673920,Thu Aug 31 02:55:34 +0000 2017,ThmsHoward,false,"#BLM- mandatory Liability Insurance for police- 45 is evil, his followers just as bad-  SCOTUS is constrained by NO ethics rules!- Restore Jackie's Rose Garden-",112200,1255,792,4,,"Thomas ""Trump is a SORE LOSER"" Howard",ThmsHoward,58854,,,false
,Tue Mar 31 20:07:20 +0000 2020,,,http://l776.us/eEdb,0,1245080259311132672,,,,en,,false,0,,,"<a href=""http://liberalforum.net"" rel=""nofollow"">Liberal Forum Political Chat</a>",James O'Keefe Telling Us That COVID-19 Is Just Like The Flu To Own The Libs https://t.co/rOsBpn1Jpu,https://twitter.com/Liberal_Forum/status/1245080259311132672,Wed Dec 18 19:24:18 +0000 2013,Liberal_Forum,false,"Liberal Forum - America's #Political Chat Room - Liberals, #Democrats, Socialists, Greens, Independents, and yes, even Conservatives welcome. #Politics",7,534,1114,31,United States of America,Liberal Forum,Liberal_Forum,45167,,https://liberalforum.net,false
,Sun Mar 29 11:15:18 +0000 2020,,,https://twitter.com/Travelito24/status/1241684250031783938,0,1244221591845851136,,,,en,,false,0,,,"<a href=""http://twitter.com/download/android"" rel=""nofollow"">Twitter for Android</a>","To be completely honest: at first, like many, I thought Covid-19 is ""just like the flu""... until I read some background info on the flu and what it did in the early 1900's... these folks are working their butts off trying to save as many lifes as they can. 1/2 https://t.co/i2SpB7tEWw",https://twitter.com/gmwubs/status/1244221591845851136,Wed Mar 31 12:32:37 +0000 2010,gmwubs,false,"husband, father, DiY, Linux engineer, Debian/Ubuntu & OpenBSD Fan (RHCE RHEL 7, OpenStack Admin, Red Hat CloudStorage, AWS)",5478,41,437,3,Netherlands,Gerben Wubs,gmwubs,1008,,,false
,Wed Apr 08 13:45:14 +0000 2020,,,https://twitter.com/lindsaywise/status/1247719173901484033,15,1247883203827859456,,,,en,,false,6,,,"<a href=""http://twitter.com/download/iphone"" rel=""nofollow"">Twitter for iPhone</a>",To all those people who said “COVID-19 is just like the flu”...🙄🤬. https://t.co/Vy4uGrJY8t,https://twitter.com/WendyOsefo/status/1247883203827859456,Mon May 07 18:10:41 +0000 2012,WendyOsefo,false,Professor | Political Commentator| Real Housewives of Potomac🌸 #RHOP|  Contributor @thehill | 🇳🇬| 📧press@wendyosefo.com 🚨Views expressed are my own🚨,5753,42400,481,208,Kingdom of Wakanda,Dr. Wendy Osefo,WendyOsefo,6032,,http://www.wendyosefo.com,true
,Tue Apr 07 03:50:53 +0000 2020,StayAtHome savelivesstayhome COVID19 StopTheSpread StayHealthyEveryone,,https://twitter.com/Channel4News/status/1246404764734304258,0,1247371241792643079,,,,en,,false,0,,,"<a href=""http://twitter.com/download/iphone"" rel=""nofollow"">Twitter for iPhone</a>",If you still think Covid-19 is just like the flu then watch this! It’s NOT! It’s horrendous and it spreads SO EASILY! #StayAtHome #savelivesstayhome #COVID19 #StopTheSpread #StayHealthyEveryone https://t.co/wZH37lKaNF,https://twitter.com/pearlhewitt/status/1247371241792643079,Mon Mar 23 12:28:29 +0000 2009,pearlhewitt,false,"British Female Narrator, Earphones & IAAward winner and 2 x SOVAS finalist, Narrated 140+ audiobooks: Mother, dog daft, Married childhood sweetheart🇬🇧🇺🇸",2050,1604,2594,67,"Houston, Texas",Pearl Hewitt 🏴󠁧󠁢󠁥󠁮󠁧󠁿🇬🇧🇺🇸,pearlhewitt,4599,,https://www.audible.com/search?keywords=Pearl+Hewitt,false
,Tue Apr 07 08:57:46 +0000 2020,,,https://twitter.com/Juliajoy/status/1247445000864116737,50,1247448470283313154,,,,en,,false,9,,,"<a href=""https://mobile.twitter.com"" rel=""nofollow"">Twitter Web App</a>","For asking that question, @Juliajoy, you will be told that you are saying Covid-19 is 'just like the flu'. It will be a lie. But it is the lie invariably told about anyone who asks about govt response to previous high fatalities from flu complications. Why do govt supporters lie? https://t.co/2f4huMSzIY",https://twitter.com/ClarkeMicah/status/1247448470283313154,Sat Nov 05 15:01:54 +0000 2011,ClarkeMicah,false,"Journalist, author, broadcaster",44,154154,0,970,England,Peter Hitchens,ClarkeMicah,148750,,http://hitchensblog.mailonsunday.co.uk/,true
,Wed Apr 01 16:06:27 +0000 2020,,,,3,1245382027005906945,ActivistaNG,1245368850109141000,1530986395,en,,,3,,,"<a href=""http://twitter.com/download/iphone"" rel=""nofollow"">Twitter for iPhone</a>","@ActivistaNG @ActionAidNG @Okwuosamj Myth 3.
COVID-19 is just like the flu....is this true?",https://twitter.com/DorcasBennie1/status/1245382027005906945,Tue Nov 17 07:36:57 +0000 2015,DorcasBennie1,false,"Prof. Scrnwriter.Passionate abt Impactg humanity positively thrgh 3D story telling &social justice 4 W,YTH&C.Activist.Envrnmtalist.SDGs Activator .Tech Entrepr.",1781,322,335,0,,A NEW DAWN #EndInsecurities #ReformNigeriaNow,DorcasBennie1,973,,,false
,Mon Apr 06 22:03:41 +0000 2020,,,https://twitter.com/TIMEX99832797/status/1247281485914222594,2,1247283863342088196,,,,en,,false,2,,,"<a href=""http://twitter.com/#!/download/ipad"" rel=""nofollow"">Twitter for iPad</a>",For those who think COVID 19 is just like the flu! https://t.co/B2HrC58j6l,https://twitter.com/FullerGraeme/status/1247283863342088196,Wed Jun 18 06:28:13 +0000 2014,FullerGraeme,false,"Attracted to people with a social conscience, a sense of fairness and a concern for the environment. Lover of nature, travel, animals, science and innovation.",93860,7025,6903,9,Sydney Australia,💧Graeme Fuller,FullerGraeme,30835,,,false
,Wed Apr 01 14:14:03 +0000 2020,,,,1,1245353737025138693,DrunkenDiviner,1245352990011281400,4852083461,en,,,0,,,"<a href=""https://mobile.twitter.com"" rel=""nofollow"">Twitter Web App</a>","@ToddP10 @Jennswhimsy @BedoyaBenardo @Dallasdaddy63 @WillemsAngie @MarieJo45528473 @Yamiche My dad supports Trump, &amp; he's a racist &amp; not very intelligent, but he was still a good dad to me &amp; I wish he could see how bad Trump is. I don't know how to explain that Trump relies on an ever-running BS machine. My dad's 65 and still working bc COVID-19 is ""just like the flu.""",https://twitter.com/DrunkenDiviner/status/1245353737025138693,Wed Jan 27 02:59:24 +0000 2016,DrunkenDiviner,false,"She/her 
I really love spaghetti 👌",10973,28,211,0,,Justia,DrunkenDiviner,1197,,,false
,Fri Mar 27 19:39:30 +0000 2020,,,https://frackingreviews.com/for-pandemics-and-climate-change-voluntary-measures-arent-enough/,0,1243623703096766468,,,,en,,false,0,,,"<a href=""https://contentstudio.io"" rel=""nofollow"">ContentStudio.io</a>","Doing so is especially difficult in the face of deliberate misinformation campaigns arguing that climate change is natural, or that COVID-19 is just like the flu. https://t.co/R8QAKYK6wF",https://twitter.com/FrackingReviews/status/1243623703096766468,Thu Aug 21 02:03:15 +0000 2014,FrackingReviews,false,A global Fracking Hub of information on the World of Fracking collected from the worlds Net to educate on the growing Concerns,1,27,57,0,Worl Wide,Fracking Reviews,FrackingReviews,4321,,http://fracking.reviews,false
,Mon Mar 30 03:34:05 +0000 2020,,,,7,1244467908236972033,,,,en,,,2,,,"<a href=""http://twitter.com/download/iphone"" rel=""nofollow"">Twitter for iPhone</a>",I hate when people say Covid 19 is just like the flu... it’s not. It’s a bit worse.,https://twitter.com/cessrouge/status/1244467908236972033,Wed Oct 28 00:45:43 +0000 2009,cessrouge,false,create waves 🌊 | jamaican 🇯🇲 IG: liqueursoaka | KSU 21’,294822,11190,2309,20,"Atlanta, GA",benz,cessrouge,246818,,http://liqueursoaka.com,false
,Sun Mar 29 11:05:27 +0000 2020,,,,0,1244219113666461701,hazelwood_dave,1244217971813363700,1015905538289422300,en,,,0,,,"<a href=""https://mobile.twitter.com"" rel=""nofollow"">Twitter Web App</a>","No, I'm not saying COVID-19 is just like the flu, but this study shows why Italy has been hit so hard.",https://twitter.com/hazelwood_dave/status/1244219113666461701,Sun Jul 08 10:28:49 +0000 2018,hazelwood_dave,false,Investor and trader. Dad. Proud South African.,1347,4837,36,56,Cape Town,Dave Hazelwood,hazelwood_dave,9425,,,false
,Fri Apr 10 13:39:32 +0000 2020,,,http://dlvr.it/RTXQLc,54,1248606541793488896,,,,en,,false,32,,,"<a href=""https://dlvrit.com/"" rel=""nofollow"">dlvr.it</a>",Nearly 3-In-5 Right-Wing News Viewers Still Believe COVID-19 Is Just Like The Flu https://t.co/FaxWBEfXs8,https://twitter.com/realTuckFrumper/status/1248606541793488896,Wed Jul 08 22:59:13 +0000 2009,realTuckFrumper,false,@hillreporter @RawStory @AlterNet https://t.co/Vy9rzsZD6r @politicususa @DeadStateTweets @DemCastUSA @MeidasTouch @teampelosi,75717,142130,96834,119,Witness Protection,#TuckFrump,realTuckFrumper,286219,,https://tuckfrump.tv,false
,Fri Apr 10 05:40:59 +0000 2020,,,,0,1248486112751841281,R3DST8Gh0ST,1248373546880880600,41704429,en,,,0,,,"<a href=""http://twitter.com/download/android"" rel=""nofollow"">Twitter for Android</a>","@EternalRound @mwash52 @BingaZingaZinga @NightlyPolitics I didn't block you (yet). I guess twitter glitched. And I'm still waiting for your explanation how covid-19 is ""just like the flu"" considering the fact that the relative death toll is 10 to 20 times higher.",https://twitter.com/GratuitousGuy/status/1248486112751841281,Sat Feb 22 19:31:44 +0000 2020,GratuitousGuy,false,"All of this has happened before, and all of this will happen again. IT guy by day, anti-fascist by night. He/him",245920,1890,2143,0,Germany,Arno Nym,GratuitousGuy,19318,,,false
,Fri Apr 10 14:30:34 +0000 2020,,https://twitter.com/TheCyanPost/status/1248619385821913093/photo/1,https://hillreporter.com/nearly-3-in-5-right-wing-news-viewers-still-believe-covid-19-is-just-like-the-flu-63944?utm_source=dlvr.it&utm_medium=twitter,0,1248619385821913093,,,,en,,false,2,,,"<a href=""https://dlvrit.com/"" rel=""nofollow"">dlvr.it</a>",Nearly 3-In-5 Right-Wing News Viewers Still Believe COVID-19 Is Just Like The Flu https://t.co/M7LBoOXYPG https://t.co/tnRtIrJfXw,https://twitter.com/TheCyanPost/status/1248619385821913093,Fri May 03 15:37:28 +0000 2013,TheCyanPost,false,Opinions expressed in TCP tweets are our own otherwise news presented here can be substantiated by fact or evidence and are from trustworthy sources in the Web.,612,274,302,0,United States,TheCyanPost,TheCyanPost,263645,,,false
,Thu Apr 02 15:33:06 +0000 2020,,,,3,1245736018722148360,JasonPo73300292,1245585158725464000,1174858741218496500,en,,,0,,,"<a href=""https://mobile.twitter.com"" rel=""nofollow"">Twitter Web App</a>","@JasonPo73300292 @coasttocoastam he's been spreading dangerous trumpian lies the ""covid-19 is just like the flu!""- I hope he gets investigated for manslaughter for all these ppl dying",https://twitter.com/ThmsHoward/status/1245736018722148360,Thu Aug 31 02:55:34 +0000 2017,ThmsHoward,false,"#BLM- mandatory Liability Insurance for police- 45 is evil, his followers just as bad-  SCOTUS is constrained by NO ethics rules!- Restore Jackie's Rose Garden-",112200,1255,792,4,,"Thomas ""Trump is a SORE LOSER"" Howard",ThmsHoward,58854,,,false
