coordinates,created_at,hashtags,media,urls,favorite_count,id,in_reply_to_screen_name,in_reply_to_status_id,in_reply_to_user_id,lang,place,possibly_sensitive,retweet_count,retweet_id,retweet_screen_name,source,text,tweet_url,user_created_at,user_screen_name,user_default_profile_image,user_description,user_favourites_count,user_followers_count,user_friends_count,user_listed_count,user_location,user_name,user_screen_name,user_statuses_count,user_time_zone,user_urls,user_verified
,Mon Apr 27 23:59:45 +0000 2020,,,https://www.nytimes.com/2020/04/27/business/coronavirus-sympathy-cards.html?referringSource=articleShare,0,1254923219359936512,,,,en,,false,0,,,"<a href=""http://twitter.com/download/iphone"" rel=""nofollow"">Twitter for iPhone</a>","Excellent, devastating story. Anyone who says covid-19 is “just like the flu” needs to read this https://t.co/c1UaBU9lU1",https://twitter.com/JenniferMascia/status/1254923219359936512,Wed Jul 01 01:59:30 +0000 2009,JenniferMascia,false,"Miami-born, California-bred New Yorker. @columbiajourn @Hunter_College @MVHS_Diablos alum. Past: @nytimes. Present: news writer @TeamTrace. jmascia@thetrace.org",29625,4524,2834,142,"New York, NY",Jennifer Mascia,JenniferMascia,25105,,http://www.thetrace.org/author/jennifer-mascia/,true
,Fri May 01 03:33:46 +0000 2020,,,,11,1256064242572300293,,,,en,,,0,,,"<a href=""http://twitter.com/download/iphone"" rel=""nofollow"">Twitter for iPhone</a>","Had a grown man today tell me: 
1. He refuses to watch news, all liars, all of em
2. Can’t believe any numbers, all numbers are spun
3. Yet he has some numbers that he believes, and they demonstrate that Covid 19 is just like the flu 

This is why America is fucked",https://twitter.com/drainbownick/status/1256064242572300293,Tue Oct 04 23:45:47 +0000 2011,drainbownick,false,l Finally Sober | Black Lives Matter l Baltimore Ravens | Prog Hater I Voidsman in @voidwitchtx l Avuncular Tendencies l,131054,1464,1820,11,"Austin, TX",Nic Sarc,drainbownick,37448,,https://drainbow1.bandcamp.com,false
,Thu Apr 23 04:45:54 +0000 2020,IsAMassiveUnderstatement,https://twitter.com/yer_boat/status/1253183292947550208/photo/1,,2,1253183292947550208,,,,en,,false,0,,,"<a href=""http://twitter.com/download/android"" rel=""nofollow"">Twitter for Android</a>","#IsAMassiveUnderstatement 
covid 19 is just like the flu https://t.co/AkgyNHXfab",https://twitter.com/yer_boat/status/1253183292947550208,Sat Nov 09 19:28:24 +0000 2019,yer_boat,false,"#VoteBiden #voteblue
I have extremely interesting views on totally uninteresting things as I am an uninteresting person 😋",1991,843,2228,1,,Klo-eek!!,yer_boat,1415,,,false
,Tue Apr 21 16:32:32 +0000 2020,,https://twitter.com/VILSHOPEWORLD/status/1252636346134355968/photo/1,,4,1252636346134355968,,,,en,,false,0,,,"<a href=""http://twitter.com/download/android"" rel=""nofollow"">Twitter for Android</a>","just had an encounter with the most ignorant customer smh💀 this woman comes up and says we shouldn't be wearing masks, ""it's bad for your lungs."" ??? she continues saying covid-19 is just like the flu and the deaths didn't have anything to do with corona + https://t.co/nvupXvMHxI",https://twitter.com/VILSHOPEWORLD/status/1252636346134355968,Thu Nov 03 22:36:53 +0000 2016,VILSHOPEWORLD,false,"no thoughts, head empty, just bangtan.
#ot7 -she/her
-171018-",105534,395,261,5,🇩🇪🇻🇳 ,vil⁷,VILSHOPEWORLD,18718,,https://dotherightthing.carrd.co/,false
,Tue Apr 21 14:37:34 +0000 2020,,,https://crooksandliars.com/2020/04/we-are-not-communist-nation-rally,1,1252607413846491136,,,,en,,false,1,,,"<a href=""http://twitter.com/download/android"" rel=""nofollow"">Twitter for Android</a>","'We Are Not A Communist Nation': Rally Organizer Denies COVID Facts, Demands Death |
&amp; Argued on Monday that COVID-19 is “just like the flu” — even though scientists believe that it is ten times more deadly.⤵️ https://t.co/NqgtxN4XeX",https://twitter.com/grinningbamE/status/1252607413846491136,Thu Jul 23 07:19:20 +0000 2009,grinningbamE,false,"Followed by @TeamPelosi🌊 #TeamPelosi💙Psychologist, Wife, Mom, Grandma #PwMe 
❤Love People🌈 #BLM 
🌊#VoteBlue🌊
#BidenHarris❤🤍💙
💙#Resister ❌#MoscowMitch🤬",222200,31174,31344,24,BLUE dot in red state Oklahoma,🐝BEA🐝💙VotesBlue💙🌱🌝🌱😷MaskUp& Care4others❤😷,grinningbamE,141286,,,false
,Sun Apr 26 18:22:40 +0000 2020,,,,0,1254476000425017344,TeachOnTheRight,1254472984200458200,1488504740,en,,,0,,,"<a href=""https://mobile.twitter.com"" rel=""nofollow"">Twitter Web App</a>",@TeachOnTheRight @JPL_Reader @tedcruz Please show me some research that states Covid-19 is just like the flu. Preferably CDC/ECDC reasearch,https://twitter.com/neekademus/status/1254476000425017344,Sun Apr 05 17:06:56 +0000 2020,neekademus,false,"Fascism is not defined by the number of its victims, but by the way it kills them.
Jean-Paul Sartre",935,19,117,0,UK 🇺🇸 🇬🇷,Neekademus,neekademus,1592,,,false
,Sun Apr 19 21:37:18 +0000 2020,,,,0,1251988266838081537,MrMontagoose,1251987205624672300,118856965,en,,,0,,,"<a href=""http://twitter.com/download/android"" rel=""nofollow"">Twitter for Android</a>",@_KJKelly @THEshabbs I'm not at all suggesting that Covid-19 is just like the flu. It is clearly worse both in terms of transmission rates (R0) and mortality rates. But these charts are trying to show how it's an order of magnitude worse. Even with seasonal flu vaccine widely administered.,https://twitter.com/MrMontagoose/status/1251988266838081537,Mon Mar 01 23:18:04 +0000 2010,MrMontagoose,false,,1050,117,328,7,"Kanata, Ontario, Canada",Walter Prager,MrMontagoose,22458,,,false
,Tue Apr 21 19:38:45 +0000 2020,COVID19 COVID Tableau dataviz,https://twitter.com/lenapatsa/status/1252683209390739456/photo/1,https://tinyurl.com/ycvubep2 https://youtu.be/whC-NkYhEgg,4,1252683209390739456,,,,en,,false,1,,,"<a href=""https://mobile.twitter.com"" rel=""nofollow"">Twitter Web App</a>","ONS weekly deaths in London, UK, updated for wk 15; the trend continues unabated. A visual aid for those who continue to claim that COVID-19 is ""just like the flu"". https://t.co/hg1GD7L0X5. As seen on @MedCrisis https://t.co/8gjG9uO7Y0 (03:09). #COVID19  #COVID #Tableau #dataviz https://t.co/IEogseJWwj",https://twitter.com/lenapatsa/status/1252683209390739456,Thu Feb 04 05:40:10 +0000 2010,lenapatsa,false,Researcher. Educator. Ph.D. Maker of things. 🇬🇷🇨🇦,7824,140,403,1,"Vancouver, BC",lenapatsa,lenapatsa,4126,,http://www.lenapatsa.com/,false
,Tue Apr 14 21:43:40 +0000 2020,,,,0,1250177929084010497,realDonaldTrump,1249886901320011800,25073877,en,,,0,,,"<a href=""https://mobile.twitter.com"" rel=""nofollow"">Twitter Web App</a>","@realDonaldTrump Hannity said that Covid-19 was just like the flu and a hoax.

You said Covid-19 is just like the flu and a hoax.

Which one of you said it first?",https://twitter.com/reluctantzealot/status/1250177929084010497,Mon Aug 17 21:39:53 +0000 2009,reluctantzealot,false,"One of last fiscal conservative capitalists left in America. Big govt, high debts govt control of biz is never OK no matter what excuse your party sells you.",39016,2498,2439,81,,Just me,reluctantzealot,260334,,,false
,Mon Apr 20 02:56:21 +0000 2020,,,https://twitter.com/npalmerrothman/status/1251852526233817095,13,1252068558676393984,,,,en,,false,7,,,"<a href=""http://twitter.com/download/iphone"" rel=""nofollow"">Twitter for iPhone</a>","Go ahead, tell me COVId-19 is just like the flu. https://t.co/8kVPjsekvB",https://twitter.com/ellynruthstrom/status/1252068558676393984,Mon Feb 15 18:08:43 +0000 2010,ellynruthstrom,false,I'm a writer and editor and a bi activist within the LGBTQ rights movement. Executive Director of @SpeakOUTBoston.,12612,1202,978,23,,Ellyn Ruthstrom,ellynruthstrom,5662,,,false
,Sat Apr 18 11:19:54 +0000 2020,CoronavirusUSA Covid_19,,https://twitter.com/AustinKellerman/status/1251326049675337730,0,1251470505267396608,,,,en,,false,0,,,"<a href=""http://twitter.com/download/android"" rel=""nofollow"">Twitter for Android</a>",#CoronavirusUSA deaths in a week compared with deaths from other causes. Next time someone says #Covid_19 is just like the flu show them this. https://t.co/QyZwayKRQZ,https://twitter.com/LarryVojtko/status/1251470505267396608,Fri Mar 08 18:54:52 +0000 2013,LarryVojtko,false,"WVIA-FM Stn Mgr, classical music host & TV public affairs host. Singer, pianist, actor. Type A-minus personality. Opinions are my own. RTs are not endorsements",3214,492,1689,57,"Pennsylvania, USA",Larry Vojtko,LarryVojtko,8320,,http://www.wvia.org/,false
,Fri Apr 24 10:28:28 +0000 2020,,https://twitter.com/Kahil/status/1253631890281476096/photo/1,,1,1253631890281476096,Twitch_Grip,1253628175009165300,1323341330,en,,false,0,,,"<a href=""http://twitter.com/download/android"" rel=""nofollow"">Twitter for Android</a>","@Twitch_Grip @brianstelter We have had more deaths in two months than the total, average regular flu death rate for the year.  But go ahead, go on out and pretend COVID-19 is just like the flu. I'm sure you'll be just fine. https://t.co/qJMlLaz5eY",https://twitter.com/Kahil/status/1253631890281476096,Fri Mar 21 23:31:47 +0000 2008,Kahil,false,"Searching for the next adventure in my life...in more than one way. #LGBTQ+

Check out my apparel site https://t.co/FNiw0m7ABC!

DM for design commissions. $Kahil",87922,959,1079,3,,Kahil,Kahil,63412,,http://spiderflystudios.com,false
,Tue Apr 21 11:11:16 +0000 2020,,,https://twitter.com/lilienfeld1/status/1251335135909122049,0,1252555497946972160,,,,en,,false,0,,,"<a href=""http://twitter.com/download/android"" rel=""nofollow"">Twitter for Android</a>","Read this thread if you think COVID-19 is ""just like the flu"" and appreciate actual science https://t.co/Oeb9wo06YP",https://twitter.com/phillyindiefan/status/1252555497946972160,Sun Jul 22 01:28:16 +0000 2012,phillyindiefan,false,Get this guy a Puppers,8966,338,630,29,"Media, PA",Keith,phillyindiefan,15928,,https://www.instagram.com/delcobadger/,false
,Mon Apr 20 13:41:46 +0000 2020,,,,2,1252230982775652354,ZiadSatNam,1251960425371046000,1004584219765379100,en,,,0,,,"<a href=""http://twitter.com/#!/download/ipad"" rel=""nofollow"">Twitter for iPad</a>","@ZiadSatNam @biden_says @ronnieg1002 @OfficialJLD Ditto for Twitter. So happy for the Mute button.🙂 Fascinating how Trolls and Bots can be denying Climate Change, then opposed to Vote by Mail, then claiming COVID-19 is just like the flu. So draining………",https://twitter.com/eegarim/status/1252230982775652354,Sat Apr 02 17:24:10 +0000 2011,eegarim,false,A tourist in my own life. Somehow persevering through Lyme disease. Expect many RTs! No DMs! #BLM #LGBTQ! 🚨ClimateEmergency!🚨,453386,8261,9056,100,"Southbound, northbound train",Miragee who is fully-vaccinated.🥳 Are you?,eegarim,266325,,,false
,Thu Apr 16 23:05:05 +0000 2020,,,https://twitter.com/JoshuaPotash/status/1250788907287023619,0,1250923196116803586,,,,en,,false,0,,,"<a href=""http://twitter.com/download/iphone"" rel=""nofollow"">Twitter for iPhone</a>","Oh my fucking.. to read it is one thing but the way he said it...

Reminder this is the “doctor” y’all were screaming in support of because COVID-19 is “just like the flu” https://t.co/7pPi9Y7k7r",https://twitter.com/TurtleOtter/status/1250923196116803586,Mon Jun 10 22:23:16 +0000 2019,TurtleOtter,false,she/her been on the interweb over a decade. you cannot hurt my feelings. ❤️💛♍️♒️ local fuckboi.,25889,83,221,0,Hell.,BLACK LIVES MATTER,TurtleOtter,13503,,,false
,Tue Apr 28 17:05:10 +0000 2020,,,,1,1255181275977015296,evolnemesis,1255180207079796700,733387787882356700,en,,,0,,,"<a href=""http://twitter.com/download/android"" rel=""nofollow"">Twitter for Android</a>","@evolnemesis @BabeTruth2 No. Faith based learning is where science is forgotten, and as such this misconception that Covid-19 is just like the flu propagates like wildfire.

Republicans seem to be the worst for this.",https://twitter.com/UninformedGuy/status/1255181275977015296,Tue Sep 16 18:49:01 +0000 2014,UninformedGuy,false,Informed. Canadian. Universally health covered.,214624,1820,2296,8,,"Gordon Shumway, Esq.",UninformedGuy,120016,,,false
,Thu Apr 16 21:18:57 +0000 2020,,,https://twitter.com/Xy5Z89/status/1250827125806022657,2,1250896484612145152,,,,en,,false,1,,,"<a href=""https://mobile.twitter.com"" rel=""nofollow"">Twitter Web App</a>",If COVID 19 is “just like the flu” why aren’t ambulances lined up with flu victims waiting to get into a hospital? https://t.co/vTJ2uyjPXI,https://twitter.com/DaleAndersen6/status/1250896484612145152,Fri Mar 08 21:44:51 +0000 2019,DaleAndersen6,false,I hate terrorism and tyrants both foreign and domestic. #GOLDCORP,83751,1255,1258,4,Goldcorp HQ,Stetson 4 inbound to Hotel 138,DaleAndersen6,53735,,,false
,Tue Apr 21 16:11:03 +0000 2020,factoverfiction soc101,,,0,1252630938770649089,,,,en,,,0,,,"<a href=""http://twitter.com/download/android"" rel=""nofollow"">Twitter for Android</a>","Can you tell fact from fiction?
1. The immediate risk of becoming seriously ill from Covid-19 is thought to be low.
2. Only older adults and young people are at risk of coronavirus.
3. Covid-19 is just like the flu.
@DrJaniceJ @JohnJayCollege 
#factoverfiction #soc101",https://twitter.com/MohimaAkther4/status/1252630938770649089,Tue Apr 21 14:55:45 +0000 2020,MohimaAkther4,true,,6,1,5,0,,Mohima Akther,MohimaAkther4,2,,,false
,Fri May 01 00:12:09 +0000 2020,,,,2,1256013502298370048,HughJassman6,1256000221944873000,1192957901373091800,en,,,0,,,"<a href=""http://twitter.com/download/android"" rel=""nofollow"">Twitter for Android</a>",@HughJassman6 @cutzie80 @jim_walkup @SenPolehanki So trumpesque. Now with 61k dead in 3 months and counting you're still ready to go with 'COVID-19 is just like the flu'? What'll it take? Extinction?,https://twitter.com/mashinaniman/status/1256013502298370048,Sun Dec 01 10:27:19 +0000 2013,mashinaniman,false,"Kenyan mwananchi speaking frankly from ground level, while clinging onto my constitution...(retweets are just that, no more)",2638,139,222,1,Kenya,Mashinani Man,mashinaniman,4359,,,false
,Tue Apr 21 02:47:00 +0000 2020,,,,1,1252428594413842437,TamerELG,1252422158149537800,125400908,en,,,0,,,"<a href=""https://mobile.twitter.com"" rel=""nofollow"">Twitter Web App</a>",@TamerELG Can't wait for Fox News to praise this decision and then in the next segment talk bout how America needs to end the shut down because COVID-19 is just like the flu,https://twitter.com/JoelWing2/status/1252428594413842437,Thu May 10 02:51:30 +0000 2012,JoelWing2,false,"Iraq analyst at Musings On Iraq Blog. Movie, music, comic book, basketball lover. Oakland Public High School teacher by profession. NO TO ALL AMAZON SELLERS.",118,11088,328,417,"Berkeley, CA",Joel Wing,JoelWing2,158570,,http://musingsoniraq.blogspot.com/,false
,Sat Apr 25 21:45:11 +0000 2020,,,,0,1254164579459854336,5151mpk1,1253974996768051200,995198022836338700,en,,,0,,,"<a href=""http://twitter.com/#!/download/ipad"" rel=""nofollow"">Twitter for iPad</a>",@5151mpk1 @grumpyMichael @ScottMorrisonMP have you seen this? I thought you and your experts said children cannot get Covid-19?,https://twitter.com/Di59K/status/1254164579459854336,Wed Oct 31 09:13:16 +0000 2012,Di59K,false,"I often speak or tweet without putting my brain in gear. If I offend anyone, tough, you need to harden up!",3697,35,112,1,,Di K,Di59K,2021,,,false
,Tue Apr 21 15:35:55 +0000 2020,,,https://twitter.com/trutherbotnet/status/1250111468378390531?s=19,0,1252622099987877889,Katojana,1252616036316319700,124730338,en,,false,0,,,"<a href=""http://twitter.com/download/android"" rel=""nofollow"">Twitter for Android</a>","@Katojana @Justinray06 @SteveRustad1 @ToddJCefaratti Because covid-19 is just like the flu?

You are proving the point of the tweet, every time you reply like this:
""Obama good! Orangeman bad!""

https://t.co/AY4Jk45w0W",https://twitter.com/trutherbotnet/status/1252622099987877889,Sun May 22 17:47:22 +0000 2016,trutherbotnet,false,"There is not a truth existing which We fear or would wish unknown to the whole world.
Shadowbanned since June 2016  #EndThe2PartySystem #AbolishPoliceUnions",8662,8357,7128,93,the internets,trutherb0t 🎭,trutherbotnet,113049,,https://twitter.com/i/lists/746473627659337728?s=09,false
,Thu Apr 16 18:09:36 +0000 2020,,,https://twitter.com/DrEricDing/status/1250438307047038979,215,1250848833069875209,,,,en,,false,74,,,"<a href=""https://mobile.twitter.com"" rel=""nofollow"">Twitter Web App</a>","Yeah, Covid-19 is just like the flu. https://t.co/SfqjwPUfI0",https://twitter.com/TimOBrien/status/1250848833069875209,Fri Feb 13 02:45:33 +0000 2009,TimOBrien,false,"Columnist, @bopinion. Priors: New York Times, Wall Street Journal, HP. Author: “TrumpNation.”",2228,190601,1425,3759,New York,Tim O'Brien,TimOBrien,55118,,https://timothylobrien.com/,true
,Wed Apr 22 06:31:35 +0000 2020,,,https://twitter.com/ryanstruyk/status/1252793606865326080,5,1252847501251538944,,,,en,"South Snyderville Basin, UT",false,0,,,"<a href=""http://twitter.com/download/iphone"" rel=""nofollow"">Twitter for iPhone</a>","Next time someone tries to tell you COVID-19 is just like the flu, remind them of these numbers https://t.co/p2G67suZMY",https://twitter.com/bjonesbrown/status/1252847501251538944,Sun Jul 19 17:17:48 +0000 2009,bjonesbrown,false,"Historian of 19th-, 20th-century Utah; Mountain Meadows Massacre; post-1890 polygamy; suffrage; Japanese American Internment Policy",21126,4925,1035,32,"Utah, USA",Barbara Jones Brown,bjonesbrown,29031,,,false
,Mon Apr 20 11:59:01 +0000 2020,,,https://twitter.com/realTuckFrumper/status/1252199217927348228,0,1252205124350545923,,,,en,,false,0,,,"<a href=""http://twitter.com/download/android"" rel=""nofollow"">Twitter for Android</a>","But COVID-19 is just like the flu, right? https://t.co/uIQbFi69ph",https://twitter.com/DizzelW/status/1252205124350545923,Fri Feb 28 13:48:11 +0000 2014,DizzelW,false,Root beer connoisseur. Airhead. Intrigued by the unknown.♊,50046,640,806,5,"Minneapolis, MN",Dr. Derp,DizzelW,16141,,,false
,Tue Apr 28 20:03:09 +0000 2020,COVID19 COVID Tableau dataviz,https://twitter.com/lenapatsa/status/1255226064877555715/photo/1,https://tinyurl.com/ycvubep2 https://youtu.be/whC-NkYhEgg,0,1255226064877555715,,,,en,,false,1,,,"<a href=""https://mobile.twitter.com"" rel=""nofollow"">Twitter Web App</a>","ONS weekly deaths in London, UK, updated for wk 16; the trend continues unabated. A visual aid for those who continue to claim that COVID-19 is ""just like the flu"". https://t.co/hg1GD7tq5x. As seen on 
@MedCrisis https://t.co/8gjG9v5JmA (03:09). #COVID19  #COVID #Tableau #dataviz https://t.co/SGKELV8TcK",https://twitter.com/lenapatsa/status/1255226064877555715,Thu Feb 04 05:40:10 +0000 2010,lenapatsa,false,Researcher. Educator. Ph.D. Maker of things. 🇬🇷🇨🇦,7824,140,403,1,"Vancouver, BC",lenapatsa,lenapatsa,4126,,http://www.lenapatsa.com/,false
,Thu Apr 30 12:49:42 +0000 2020,,,https://en.wikipedia.org/wiki/Prevention_paradox,2,1255841759877349376,hilltothesouth,1255839914907693000,1004040371825926100,en,,false,0,,,"<a href=""https://mobile.twitter.com"" rel=""nofollow"">Twitter Web App</a>","@hilltothesouth @Imamofpeace That wasn't my point. This was -

https://t.co/HcIsJsTB5T

And if you still think covid-19 is just like the flu, peace out.",https://twitter.com/mendelkalmenson/status/1255841759877349376,Fri Dec 21 20:06:54 +0000 2012,mendelkalmenson,false,"Student of the Sciences. Love my family and lasagna, not necessarily in that order.
Academic account found here @MMKalmenson.",606,143,230,0,r(t),Mendel Kalmenson,mendelkalmenson,3733,,,false
,Sun Apr 19 11:26:27 +0000 2020,,,https://twitter.com/sannewman/status/1251646628299243521,0,1251834541490216960,,,,en,,false,0,,,"<a href=""http://twitter.com/download/android"" rel=""nofollow"">Twitter for Android</a>",Imagine STILL arguing that COVID-19 is just like the flu. https://t.co/CCL0Q6KOEl,https://twitter.com/progressative/status/1251834541490216960,Sun Apr 19 07:00:21 +0000 2020,progressative,false,"nah fam. cancel.
MORE COWBELL FFS",630,10,272,0,South Africa,mr charismaless,progressative,85,,,false
,Mon Apr 27 16:59:46 +0000 2020,,,https://twitter.com/EllenBarryNYT/status/1254784306200711169,0,1254817528452284426,,,,en,,false,0,,,"<a href=""https://mobile.twitter.com"" rel=""nofollow"">Twitter Web App</a>","""But Covid-19 is just like the flu!"" https://t.co/YUxkwWRifB",https://twitter.com/TruthMatters333/status/1254817528452284426,Thu Mar 28 01:55:28 +0000 2019,TruthMatters333,false,"1) Wear a mask
2) Social Distance
3) Vitamin Regimen 
4) Exercise
5) DE-STRESS  
Lots about to go down. Don't miss it. #Karma2021 #SussexSquad #BidenHarris #BLM",77015,599,4071,5,"Vit C, Vit D, Vit A, Zinc",Truth STILL Matters - GODDESS Uprising,TruthMatters333,104971,,,false
,Sun Apr 19 17:16:36 +0000 2020,,,https://twitter.com/jeremynewberger/status/1251881401491886083,1,1251922661237800965,,,,en,,false,0,,,"<a href=""http://twitter.com/download/iphone"" rel=""nofollow"">Twitter for iPhone</a>",How about it @realDonaldTrump @IngrahamAngle @seanhannity why don’t you lead the protests in person? Without masks since you think Covid-19 is just like the flu? https://t.co/iiNSBPyGYW,https://twitter.com/judithfuller6/status/1251922661237800965,Fri May 25 00:19:01 +0000 2012,judithfuller6,false,,72677,107,1723,0,,judith fuller,judithfuller6,4439,,,false
,Fri Apr 17 00:50:42 +0000 2020,,,https://www.washingtonpost.com/outlook/2020/04/16/coronavirus-leading-cause-death/?arc404=true,1,1250949774791958528,,,,en,,false,0,,,"<a href=""http://itunes.apple.com/us/app/twitter/id409789998?mt=12"" rel=""nofollow"">Twitter for Mac</a>","For those saying COVID-19 is “just like the flu..."" https://t.co/A3CwngN288",https://twitter.com/mcarlstromDR/status/1250949774791958528,Thu Jan 13 04:17:03 +0000 2011,mcarlstromDR,false,"Interested in, but not limited to: Tech, Teaching, EDU, Coaching, Leadership, Photography, Nature, my wife & family, my dogs/cats. MCSS BD - My views are my own",56220,1354,2214,185,Northern MN - the Cheap Seats,Matt Carlstrom,mcarlstromDR,45603,,,false
,Sat Apr 18 15:24:24 +0000 2020,,,,3,1251532038194282496,BCJ166,1251247611702653000,953226678762958800,en,,,0,,,"<a href=""https://mobile.twitter.com"" rel=""nofollow"">Twitter Web App</a>","@BCJ166 @justinamash Right. But individual responsibility requires individual responsibility. These idiots are advocating football games, going to the beach, and movie theaters. They believe COVID-19 is ""just like the flu"" and refuse to take responsibility for their thinking or actions.",https://twitter.com/AntonioBuehler/status/1251532038194282496,Sat Sep 05 01:20:05 +0000 2009,AntonioBuehler,false,He/him. Anti-oppression. Liberation & education: @AbromeEd. Stop institutionalized violence: @PeacefulStreets. #EmancipatedLearning #ACAB #mutualaid 🖤❤️↙️↙️↙️,14766,3902,356,158,"Austin, TX",Antonio Buehler,AntonioBuehler,100020,,http://Abrome.com,false
,Sun Apr 26 18:09:54 +0000 2020,,,,1,1254472790557802499,soledadobrien,1254453688061624300,26548315,en,,,1,,,"<a href=""http://twitter.com/download/iphone"" rel=""nofollow"">Twitter for iPhone</a>",@soledadobrien We need these international students. Look at the GOP base. They believe the Covid-19 is just like the flu.,https://twitter.com/SueBee1410/status/1254472790557802499,Tue Aug 11 21:00:57 +0000 2009,SueBee1410,false,,89611,2031,3385,0,,Susanb,SueBee1410,45522,,,false
,Wed Apr 29 23:21:46 +0000 2020,,,,2,1255638434821083138,,,,en,,,0,,,"<a href=""http://twitter.com/download/iphone"" rel=""nofollow"">Twitter for iPhone</a>",Which one of the quack FOX loving doctors on TV is still saying Covid 19 is just like the flu? My parents were reciting it like the sheeple they have become since their indoctrination into FOX. 🤬,https://twitter.com/llagxena/status/1255638434821083138,Sat Mar 23 22:14:46 +0000 2013,llagxena,false,I have a passion for teaching but an even greater passion for justice. These are the times that try men's souls and it is up to each of us to speak and act.,1403,439,200,10,Lowville NY,Lori Atkinson,llagxena,11767,,,false
,Tue Apr 28 23:57:44 +0000 2020,,https://twitter.com/LilliaPoveda/status/1255285099899293696/photo/1,,4,1255285099899293696,,,,en,"Knoxville, TN",false,1,,,"<a href=""http://twitter.com/download/android"" rel=""nofollow"">Twitter for Android</a>","Covid-19 is ""just like the flu"" https://t.co/yJtkEPb5JW",https://twitter.com/LilliaPoveda/status/1255285099899293696,Wed Jul 24 23:45:14 +0000 2013,LilliaPoveda,false,utk alumna 🍊 get vaccinated!,38882,650,351,3,"Knoxville, TN",Lillia Poveda,LilliaPoveda,4887,,,false
