coordinates,created_at,hashtags,media,urls,favorite_count,id,in_reply_to_screen_name,in_reply_to_status_id,in_reply_to_user_id,lang,place,possibly_sensitive,retweet_count,retweet_id,retweet_screen_name,source,text,tweet_url,user_created_at,user_screen_name,user_default_profile_image,user_description,user_favourites_count,user_followers_count,user_friends_count,user_listed_count,user_location,user_name,user_screen_name,user_statuses_count,user_time_zone,user_urls,user_verified
,Fri Mar 13 10:47:50 +0000 2020,,,,1,1238416472600387584,vcbarbie,1238414942811947000,27264325,en,,,0,,,"<a href=""http://twitter.com/download/iphone"" rel=""nofollow"">Twitter for iPhone</a>",@vcbarbie Please please!  Had an hour convo wit my homie the other night trying to correct his faulty thought process on how covid 19 is just like the flu so we shouldn’t worry about it...  🤦🏾‍♂️🤦🏾‍♂️🤦🏾‍♂️🤦🏾‍♂️,https://twitter.com/DeckEntKingpin/status/1238416472600387584,Mon Jun 01 21:50:20 +0000 2009,DeckEntKingpin,false,"Father, brother, producer, organic soap maker, Dimple king, weight loss enthusiast, Eagles fanatic, MCU Expert, Sci-fi Blerd, Your fav Emcee’s fav Emcee 💯",1614,335,489,11,"Muck City, NJ, USA",DeckEnt Kingpin,DeckEntKingpin,3040,,,false
,Thu Mar 12 16:58:22 +0000 2020,,,,0,1238147333428109313,,,,en,,,0,,,"<a href=""https://mobile.twitter.com"" rel=""nofollow"">Twitter Web App</a>","The other day, someone on Twitter asked how to get through to people who think COVID-19 is just like the flu. One way is to compare the percentages of people who die. The death rate is higher for COVID-19, &amp; the seriously ill require weeks of intensive care, straining resources.",https://twitter.com/happyhexer/status/1238147333428109313,Tue Jun 01 06:02:54 +0000 2010,happyhexer,false,,39594,354,232,10,,Ellen Brockaway,happyhexer,64893,,,false
,Sun Mar 22 19:14:18 +0000 2020,,,,46,1241805420181757957,,,,en,,,14,,,"<a href=""https://mobile.twitter.com"" rel=""nofollow"">Twitter Web App</a>","Apparently, when Trump became president, he got rid of all of his security experts and intel. and decided to take China, Russia and North Korea's word for everything

""Putin said he didn't do it""

""We exchanged love letters""

""Covid 19 is just like the flu"" 

Feel safer?",https://twitter.com/rise_alien/status/1241805420181757957,Tue Jul 24 02:23:11 +0000 2018,rise_alien,false,"Author/blogger - I wrote a badass book. UCLA grad/Poli-Sci. Part of the various, exotic, sexual groups. Motivated by ❤ but sounds a lot like rage. #Resistance",112313,20857,18222,38,Arkansas,Rise of the Alien Queen,rise_alien,25964,,http://Riseofthealienqueen.com,false
,Thu Mar 26 11:36:22 +0000 2020,,,https://www.nytimes.com/interactive/2020/03/25/opinion/coronavirus-trump-reopen-america.html,1,1243139730788749312,,,,en,,false,0,,,"<a href=""https://mobile.twitter.com"" rel=""nofollow"">Twitter Web App</a>","We cannot ask Trump on what scientific model he is basing his idea of opening business again in 17 days, or how he knows COVID-19 is just like the flu, or maybe not even as bad. But these are questions to ask rational people. https://t.co/h5XBMmy6pO",https://twitter.com/MonaJWilliam/status/1243139730788749312,Sat Sep 29 20:15:41 +0000 2018,MonaJWilliam,false,The main task of the leader is to keep his ear to the ground. John Dewey,25694,190,159,2,,Mona Williams,MonaJWilliam,5065,,,false
,Tue Mar 17 02:48:51 +0000 2020,,,,0,1239745485088460808,,,,en,,,1,,,"<a href=""http://twitter.com/download/iphone"" rel=""nofollow"">Twitter for iPhone</a>","people out here saying the COVID-19 is just like the flu so why are we making it such a big deal ,while immediate risk is still considered to be low for most Americans, COVID-19 is still evolving at the moment symptoms range from the common cold to such potentially death 1/4",https://twitter.com/officially_gab/status/1239745485088460808,Sun Aug 27 02:06:37 +0000 2017,officially_gab,false,,201,29,33,0,,Gabe🎯,officially_gab,1690,,,false
,Mon Mar 23 02:32:13 +0000 2020,,,,1,1241915623615205379,,,,en,,,0,,,"<a href=""https://mobile.twitter.com"" rel=""nofollow"">Twitter Web App</a>","One ignorant argument, under the erroneous assumption that COVID-19 is ""just like the flu,"" is ""we'll get it, get immunity, and won't have to deal with it again.""

The reality is viruses mutate. The immune system can only deal with bugs it can identify—it's different each year.",https://twitter.com/adamjasonp/status/1241915623615205379,Thu Jan 08 03:46:23 +0000 2015,adamjasonp,false,Programmer. Sleepless in not-Seattle. Nonpartisan,47863,451,389,35,Maine,Adam,adamjasonp,22373,,http://libertarianinmind.WordPress.com,false
,Fri Mar 13 11:58:35 +0000 2020,COVIDー19,https://twitter.com/julzcoco/status/1238434278318497793/photo/1,,2,1238434278318497793,,,,en,,false,1,,,"<a href=""http://twitter.com/download/iphone"" rel=""nofollow"">Twitter for iPhone</a>","For those of you saying, COVID-19 is just like the flu. Symptom wise, sure. #COVIDー19 https://t.co/xHVSgyreuZ",https://twitter.com/julzcoco/status/1238434278318497793,Sun Mar 31 15:08:52 +0000 2019,julzcoco,false,,20946,154,183,0,,Julia,julzcoco,2225,,,false
,Wed Mar 18 23:13:35 +0000 2020,Flu COVID19 SARS MERS COVID19,https://twitter.com/JCastro_Marrero/status/1240416087289802753/photo/1,,24,1240416087289802753,,,,en,"Barcelona, Spain",false,18,,,"<a href=""http://twitter.com/download/iphone"" rel=""nofollow"">Twitter for iPhone</a>","Let's dispel the notion that ""novel COVID-19 is just like the flu"".  Sharing this striking comparison of #Flu, #COVID19, #SARS and #MERS. #COVID19 is 30x more deadly and almost 2x more contagious than the flu. We have no existing immunity to COVID19. https://t.co/I6FOzSSY76",https://twitter.com/JCastro_Marrero/status/1240416087289802753,Thu Oct 01 16:41:40 +0000 2015,JCastro_Marrero,false,I am a Senior Researcher in the Rheumatology Division (ME/CFS Research Unit - VHIR) at the Vall d'Hebron University Hospital Campus @vallhebron (@VHIR_),174,688,787,9,"Barcelona, Spain","Jesus Castro-Marrero, Ph.D.",JCastro_Marrero,256,,http://www.vhir.org/portal1/fitxa-personal.asp?id=51698,false
,Fri Mar 20 17:01:03 +0000 2020,,,https://news.sky.com/video/coronavirus-italy-the-shocking-centre-of-the-covid-19-crisis-11960656,4,1241047112978137088,,,,en,,false,0,,,"<a href=""http://twitter.com"" rel=""nofollow"">Twitter Web Client</a>",To those that think COVID-19 is just like the flu... Not trying to scaremonger but you should see what is happening with the Coronavirus in Italy: The shocking centre of the COVID-19 crisis https://t.co/0hIckx2POq,https://twitter.com/WilkinLee/status/1241047112978137088,Sun Apr 18 11:55:49 +0000 2010,WilkinLee,false,Where there's a Wilkin there's a way,15325,4889,1023,29,Reading,Wilkin Lee,WilkinLee,10220,,http://www.instagram.com/i_am_wilkin/,true
,Fri Mar 20 17:51:15 +0000 2020,,,,1,1241059746351898630,SteveKettmann,1241045611752779800,278116165,en,,,0,,,"<a href=""http://twitter.com/download/android"" rel=""nofollow"">Twitter for Android</a>",@SteveKettmann @SteveSchmidtSES I want to know where they pull their sample for the polls. Are these the same willfully ignorant folks that think Covid-19 is just like the flu?,https://twitter.com/jerilyn_neal/status/1241059746351898630,Wed Aug 21 21:43:06 +0000 2013,jerilyn_neal,false,"Mom, Nerd, fanWoman, lover of words, skeptic, liberal. #Resist #Question #SPNFamily",53697,348,1399,1,"Poteau, OK",wishes_whimsy3,jerilyn_neal,5187,,,false
,Wed Mar 25 23:37:00 +0000 2020,,,,3,1242958695933169665,Kickass_monk,1242958694976913400,992079995685060600,en,,,3,,,"<a href=""https://mobile.twitter.com"" rel=""nofollow"">Twitter Web App</a>","4. COVID-19 is just like the flu
SARS-CoV-2 definitely has flu like symptoms- aches, fever, and cough. both COVID-19 and flu can also lead to pneumonia. However, COVID-19 is more dangerous with  with a mortality rate between 1% and 3%,10-50 times greater than the seasonal flu",https://twitter.com/Kickass_monk/status/1242958695933169665,Thu May 03 16:34:37 +0000 2018,Kickass_monk,false,"Proud follower of Sanathana Dharma,  Twitter addict, pseudo-communosecular, India loving bigot. Recently blocked by 
@AudreyTruschke",25886,738,157,3,,The_Preying_Mantis,Kickass_monk,24749,,,false
,Mon Mar 23 16:58:06 +0000 2020,,,,0,1242133530328682503,GovHolcomb,,4919082864,en,,,0,,,"<a href=""https://mobile.twitter.com"" rel=""nofollow"">Twitter Web App</a>","@GovHolcomb 
This COVID- 19 is just like the flu. You guys are saying there is all these death due to "" COVID- 19"" .",https://twitter.com/Garrett49490706/status/1242133530328682503,Mon Mar 23 11:43:19 +0000 2020,Garrett49490706,false,Off road guy and Mechanical engineering.  Dont deal with BS.  Doing the single thing until someone comes.,1,0,5,0,,What's up Doc,Garrett49490706,235,,,false
,Wed Mar 25 04:27:38 +0000 2020,,,,28,1242669446478671872,,,,en,,,1,,,"<a href=""http://twitter.com/download/android"" rel=""nofollow"">Twitter for Android</a>","Ah, yes, COVID-19 is just like the flu. In fact, every year, large swaths of life grind to a halt and also famous people upload videos about their flu test.",https://twitter.com/ItsTheBrandi/status/1242669446478671872,Sun Apr 28 19:35:50 +0000 2013,ItsTheBrandi,false,"Fmr Co-host:Bill Corbett's Funhouse. other blogs:Heathcliff, For Why?, @mnfaircliches.co-founder #SnackCaucus.Eph.

I hate RCV.
venmo/cashapp:itsthebrandi",68289,21505,4102,193,MN,Downtown Brandi Frown 😾,ItsTheBrandi,325986,,http://www.houseofprocrastination.org,true
,Tue Mar 17 15:39:28 +0000 2020,,,,2,1239939417873231873,,,,en,,,0,,,"<a href=""http://twitter.com/download/iphone"" rel=""nofollow"">Twitter for iPhone</a>","For everyone who says COVID-19 is “just like the flu”:
15-30x more dangerous 
Those at risk, ie people with autoimmune diseases, must be terrified 
It’s not a Chinese Virus it has a name call it by that. 
My mother has an MS so don’t try and tell us that “it’s just like the flu”",https://twitter.com/ConorMale/status/1239939417873231873,Sun Apr 21 12:00:27 +0000 2019,ConorMale,false,"Democratic Socialist, Activist with Ohio Humanity First Movement @hf_ohio, and President of Licking County Democrats @LiCoDemClub",1467,1600,455,4,,Conor Male 🧢,ConorMale,1672,,,false
,Wed Mar 18 03:00:30 +0000 2020,,,https://twitter.com/jeremycyoung/status/1239975682643357696,1,1240110805384933376,,,,en,"Cleveland, OH",false,0,,,"<a href=""http://twitter.com/download/iphone"" rel=""nofollow"">Twitter for iPhone</a>",For people who think that COVID-19 is “just like” the flu and will pass on its own... https://t.co/YMRVdrSauq,https://twitter.com/DanielJFord/status/1240110805384933376,Thu Mar 18 04:37:24 +0000 2010,DanielJFord,false,CLE / Host @thelotlpodcast / @BGSU Alum / #LOTL,11808,552,1334,6,"Cleveland, OH",Daniel Ford,DanielJFord,20731,,http://www.lotlpodcast.com,false
,Wed Mar 25 21:16:06 +0000 2020,,,,0,1242923237366886400,JoyAnnReid,1242796795752853500,49698134,en,,,0,,,"<a href=""http://twitter.com/download/iphone"" rel=""nofollow"">Twitter for iPhone</a>","@JoyAnnReid General Dentist in my building is full on MAGA. He thinks COVID-19 is just like the flu and basically a hoax.
He is 70 plus year old drilling away and causing aerosol with his drill.",https://twitter.com/blink_hem/status/1242923237366886400,Tue Dec 06 06:50:15 +0000 2016,blink_hem,false,,171307,343,1147,6,,Blink Hem,blink_hem,42773,,,false
,Sun Mar 15 15:07:51 +0000 2020,,,https://www.nbcnews.com/politics/meet-the-press/sixty-percent-believe-worst-yet-come-u-s-coronavirus-pandemic-n1159106,93,1239206682980429824,,,,en,,false,32,,,"<a href=""https://mobile.twitter.com"" rel=""nofollow"">Twitter Web App</a>","Trump said COVID-19 is just like the flu &amp; contained

Scientist Dr. Fauci says it will get much worse

Only 40% of Republicans think the worst is yet to come
74% of Republicans think their day-to-day lives won't change in a major way

Cult before science!
https://t.co/IedwwQuub6",https://twitter.com/WilDonnelly/status/1239206682980429824,Wed Jun 10 19:15:30 +0000 2009,WilDonnelly,false,"I didn't vote for a sexual predator, fraudster & conman who stole from his charity, or a draft-dodger who attacked POWs and Gold Star families. How about you?",43688,123441,41345,532,"PA, USA",Facts Do Matter,WilDonnelly,44122,,http://factsdomatter.com,false
,Sun Mar 22 10:44:46 +0000 2020,,,https://www.propublica.org/article/a-medical-worker-describes--terrifying-lung-failure-from-covid19-even-in-his-young-patients,0,1241677190686793728,,,,en,,false,0,,,"<a href=""http://twitter.com/download/iphone"" rel=""nofollow"">Twitter for iPhone</a>","Anyone who is still saying COVID-19 is “just like the flu” should read this. Scary stuff:
https://t.co/EvtMwp7QOQ",https://twitter.com/zakarasm/status/1241677190686793728,Wed Feb 13 22:42:59 +0000 2013,zakarasm,false,"Believer in public goods. Skeptic that profit motive and self-interest will solve most of our social problems. Director, Ashoka United States. Views are my own.",3981,315,433,4,"Burlington, VT",Michael Zakaras,zakarasm,1287,,,false
,Thu Mar 12 22:43:11 +0000 2020,TrumpVirus TrumpVirusTestingFailure,,,0,1238234110818222081,washingtonpost,1238101039330603000,2467791,en,,,0,,,"<a href=""http://twitter.com/download/iphone"" rel=""nofollow"">Twitter for iPhone</a>",@washingtonpost And FauxNews and others keep stating that COVID-19 is “just like the flu”. #TrumpVirus #TrumpVirusTestingFailure,https://twitter.com/sexy_tortoise/status/1238234110818222081,Fri Nov 09 18:49:56 +0000 2018,sexy_tortoise,false,Progressive he/him. Lake Michigan is the best body of water and I will fight you to prove it. Most people suck. I hunt TBF posters without mercy.,1156,50,290,0,"Ludington, MI",Master TBF hunter.,sexy_tortoise,377,,,false
,Mon Mar 23 00:53:19 +0000 2020,,,https://nymag.com/intelligencer/2020/03/the-story-of-a-coronavirus-infection.html?utm_source=tw&utm_campaign=nym&utm_medium=s1,65,1241890738755047424,,,,en,,false,79,,,"<a href=""https://mobile.twitter.com"" rel=""nofollow"">Twitter Web App</a>","Terrifying piece by @ManvBrain on what coronavirus does to your body. 

Everyone who still thinks Covid-19 is ""just like the flu"" and isn't socially distancing should read it. https://t.co/xLsqgGdBY4",https://twitter.com/Ian_Fraser/status/1241890738755047424,Mon Nov 30 12:20:35 +0000 2009,Ian_Fraser,false,Journalist & author of Shredded: Inside RBS 'Zola-esque' – Bill Jamieson; 'A masterpiece' – @UniMainz_Angl_P 'Read it & weep' – @martinwolf_ see https://t.co/hSUWP1B0Qo,27916,33511,891,850,United Kingdom,Ian Fraser,Ian_Fraser,19582,,http://www.ianfraser.org/biography/,true
,Fri Mar 20 22:38:33 +0000 2020,Covid_19 CoronaCrisis coronavirusuk StayAtHome,,,0,1241132046598184966,,,,en,,,0,,,"<a href=""http://twitter.com/download/android"" rel=""nofollow"">Twitter for Android</a>","Saying #Covid_19 Is just like the flu is the same as saying Irritable Bowel Disease is just like Bowel Cancer. Both affect the large intestine, both have similar symptoms, however they can have vastly different outcomes.
#CoronaCrisis #coronavirusuk #StayAtHome",https://twitter.com/raggydollnet/status/1241132046598184966,Sun Feb 08 20:59:54 +0000 2009,raggydollnet,false,Small person in a big world...literally.,2150,752,2577,40,UK,Elaine 💙 😷⚠ #CountLongCOVID #LongCOVID,raggydollnet,9839,,,false
,Mon Mar 16 01:34:47 +0000 2020,,,https://twitter.com/StevenTDennis/status/1239291010057986051,1,1239364458654453765,,,,en,,false,0,,,"<a href=""https://mobile.twitter.com"" rel=""nofollow"">Twitter Web App</a>",For all who are still delusional enough to think COVID-19 is just like the flu or common cold: https://t.co/jicJ0rFVJT,https://twitter.com/AnneVanAcker/status/1239364458654453765,Tue Feb 16 01:38:39 +0000 2010,AnneVanAcker,false,,150320,417,385,0,"Saratoga Springs, NY",Anne Van Acker,AnneVanAcker,4458,,http://www.annevanacker.arbonne.com,false
,Fri Mar 20 16:50:16 +0000 2020,COVID19 Coronavirus,https://twitter.com/AndrewYee2/status/1241044399053774848/photo/1,https://www.vox.com/science-and-health/2020/3/18/21184992/coronavirus-covid-19-flu-comparison-chart,0,1241044399053774848,,,,en,,true,0,,,"<a href=""https://about.twitter.com/products/tweetdeck"" rel=""nofollow"">TweetDeck</a>","Covid-19 is just like the flu……. TL;DR: twice as infectious, hospitalises 10 times more, at least 10 times higher mortality rate #COVID19 #Coronavirus  https://t.co/NQ2qCbXczZ https://t.co/i70Ct9RcTR",https://twitter.com/AndrewYee2/status/1241044399053774848,Thu Jun 28 13:21:13 +0000 2018,AndrewYee2,false,"🇪🇺 Freelance web designer. ⚽ MUFC fan, movies, music, food, gym. 🐕. Instagram: andrewyee. #FPL (ID:17426) 85k OR 18/19. 📺: https://t.co/wyRY5d1PAc",12555,581,1133,3,"Manchester, England",Andrew Yee,AndrewYee2,20344,,http://about.me/andrewyee,false
,Thu Mar 12 15:53:40 +0000 2020,,,,0,1238131052582928385,,,,en,,,0,,,"<a href=""http://twitter.com/download/android"" rel=""nofollow"">Twitter for Android</a>","COVID-19 is just like the flu

Only older adults and young people are at risk coronaviruses can infect people of any age. However, older adults or individuals with preexisting health conditions, such as diabetes or asthma, are more likely to become severely ill.",https://twitter.com/Leefy_Leef6/status/1238131052582928385,Mon Dec 05 23:50:21 +0000 2011,Leefy_Leef6,false,"😎 HAKUNA MATATA 😎 c'est la vie🤷🏾‍♂️
Jersey✈Ohio 
Do what you gotta do DON'T matter who proud of you just do what you gotta do.
#🌎🎣🐛 #WorldsbaitLeefSaidIt",16267,1010,1000,6,,#WorldsBaitLeef 🇬🇾,Leefy_Leef6,75312,,,false
,Mon Mar 23 15:47:06 +0000 2020,,,,0,1242115665496080385,alanklement,1242103214914375700,19033970,en,,,0,,,"<a href=""https://mobile.twitter.com"" rel=""nofollow"">Twitter Web App</a>","@alanklement @realDonaldTrump Our president goes on TV to say Covid-19 is just like the Flu, that it's all a chinese conspiracy and that is not that serious. Unbelievable. Our luck is that the state governors are not listening to him and taking measures like lockdown to enforce social isolation.",https://twitter.com/felipecb_/status/1242115665496080385,Fri Sep 18 04:06:03 +0000 2009,felipecb_,false,Product Marketing Manager @vtextruecloud. #Marketing #ProductManagement #ProductMarketing #Product #Growth pt-br • en-us | ele/o • he/him,73532,2019,3194,266,São Paulo,Felipe Barbosa,felipecb_,22753,,https://www.felipebarbosa.me,false
,Sat Mar 14 05:23:23 +0000 2020,,,,2,1238697210872647680,,,,en,,,0,,,"<a href=""http://twitter.com/download/iphone"" rel=""nofollow"">Twitter for iPhone</a>","When people tell me that COVID-19 is just like the flu, or just a bit worse or less bad, I tell them either one could kill me and then I let that sink in. Please please please remember your immunocompromised friends at this time!",https://twitter.com/lovelyfreak64/status/1238697210872647680,Wed Feb 04 16:14:52 +0000 2015,lovelyfreak64,false,depressed but well dressed➖she/her➖🏳️‍🌈 ➖BLACK LIVES MATTER,4460,74,288,0,,🎷s a r a h🎷,lovelyfreak64,1293,,,false
,Fri Mar 20 20:11:36 +0000 2020,Covid_19,,,1,1241095065986048007,,,,en,,,0,,,"<a href=""http://twitter.com/download/android"" rel=""nofollow"">Twitter for Android</a>","To me #Covid_19 is just like the flu! 
BUT as there is no vaccine ready  I accept the measures, stick to the rules and behave 
BECAUSE  
- I don't want to infect someone who could die 
- I don't want to be guilty if the clinics break down  and - I want it to be over soon!",https://twitter.com/Alianka11/status/1241095065986048007,Mon Oct 06 07:43:34 +0000 2014,Alianka11,false,"#Supernatural #SPN  #LinkinPark #LP #LPU #THWKiel #SPNFamily    
   Music  Nature  Handball     
-sometimes not getting the right sense, still learning English-",23988,561,198,22,North of Germany,Alianka (Antje),Alianka11,21028,,,false
,Mon Mar 23 01:12:37 +0000 2020,,,,1,1241895592835637248,,,,en,,,0,,,"<a href=""http://twitter.com/download/android"" rel=""nofollow"">Twitter for Android</a>","The White House and the media lies to millions of people, these people think they think for themselves, trump and fox news change their own minds/ report correct info, the people retain the falsehoods. That's why people still think covid-19 is just like the flu or whatever",https://twitter.com/autodiopter/status/1241895592835637248,Tue May 14 17:12:35 +0000 2019,autodiopter,false,i'm a common peasant,3029,46,234,1,,ophanim,autodiopter,1200,,,false
,Thu Mar 12 21:43:13 +0000 2020,,,,2,1238219019842281473,,,,en,,,0,,,"<a href=""http://twitter.com/download/iphone"" rel=""nofollow"">Twitter for iPhone</a>","COVID-19 is just like the flu. It was first discovered in 2003 as SARS, mutated into MERS-CoV into 2012 and now mutated again into COVID-19. There’s no mass hysteria about the flu so why this??",https://twitter.com/DanyaSwills/status/1238219019842281473,Fri Jul 08 18:31:31 +0000 2011,DanyaSwills,false,betrayed by grandma,25328,342,354,2,,mr. bitch,DanyaSwills,15726,,https://www.etsy.com/shop/StrawberryGirlPaints,false
,Sun Mar 15 00:17:31 +0000 2020,,,,7,1238982625064374272,,,,en,,,0,,,"<a href=""http://twitter.com/download/iphone"" rel=""nofollow"">Twitter for iPhone</a>","wow covid 19 is just like the flu huh? can we have an ORIGINAL virus for once, something that makes your lungs explode or something i’m tired of coughing",https://twitter.com/aliciapitman_/status/1238982625064374272,Tue Dec 18 23:21:16 +0000 2018,aliciapitman_,false,i just wanna be your shadow,2240,39,72,0,co! she/her! ,fred from scooby doo,aliciapitman_,710,,,false
,Sun Mar 15 13:07:06 +0000 2020,AL AL,,,0,1239176297886203906,,,,en,,,0,,,"<a href=""http://twitter.com/download/iphone"" rel=""nofollow"">Twitter for iPhone</a>","In #AL I still hear ppl TODAY that Covid 19 is just like the flu or is a bunch of Dem shenanigans?? We need a major improvement in our local leaders giving out info. Friday, we had our “1st confirmed cases” in AL and last night it was 11 with 74 “approved for testing” Wake up #AL",https://twitter.com/adisasterreally/status/1239176297886203906,Mon Sep 12 17:08:34 +0000 2016,adisasterreally,false,#𝑽𝒐𝒕𝒆𝑩𝒍𝒖𝒆 🌊🌊#𝑫𝒆𝒎𝒐𝒄𝒓𝒂𝒕 𝑭𝒐𝒓𝒆𝒗𝒆𝒓 #𝑹𝒆𝒔𝒊𝒔𝒕𝒂𝒏𝒄𝒆 𝑭𝒐𝒓𝒆𝒗𝒆𝒓 🌊🌊🌊🌊🌊#𝑩𝒊𝒅𝒆𝒏 #𝑯𝒂𝒓𝒓𝒊𝒔,23445,3023,4947,9,"Alabama, USA",𝑨𝒎𝒆𝒍𝒊𝒂 𝑺𝒘𝒆𝒆𝒏𝒆𝒚,adisasterreally,49304,,,false
,Thu Mar 12 22:41:48 +0000 2020,,,,0,1238233761885515776,YeahIsa21707928,1238231692927815700,1031498231832825900,en,,,0,,,"<a href=""http://twitter.com/#!/download/ipad"" rel=""nofollow"">Twitter for iPad</a>","@YeahIsa21707928 Smart! I have a work friend who has tickets to a Post Malone concert this weekend and she’s livid that the concert will likely be cancelled! She must watch a lot of foxnews because she thinks COVID-19 is just like the flu and “they don’t cancel concerts during flu season”!

OMG!",https://twitter.com/scott4pendleton/status/1238233761885515776,Thu Mar 06 17:01:06 +0000 2008,scott4pendleton,false,"Joe won, get over it! Proudly one of 81,282,376 - trump will always disgust me! #Resist #BLM #FBR #GoodTrouble #OneV1 Z27 - In love with ❤️@monalizza",146975,22524,21904,8,"Trump Free Zone, AZ",Scott is Disgusted - Fµck Racism,scott4pendleton,108997,,,false
,Mon Mar 16 10:37:19 +0000 2020,,,,3,1239500988328726528,MadamEarth,1239500067532230700,968842541222084600,en,,,0,,,"<a href=""https://mobile.twitter.com"" rel=""nofollow"">Twitter Web App</a>","@MadamEarth @ox_jakeox Mine says Covid_19 is just like the flu
Told him hes no welcome in my home until its all over",https://twitter.com/Real_Eddy_S/status/1239500988328726528,Fri Jul 10 08:50:48 +0000 2009,Real_Eddy_S,false,"Wary of Politicians
I Care about the planet/ Justice/freedom Independent Journalism
Swear too often",179843,1421,1038,5,Sydney Australia,Eddy Equality,Real_Eddy_S,33809,,,false
,Wed Mar 18 21:47:42 +0000 2020,,,,4,1240394474536210436,Fxhedgers,1240394068640829400,31064165,en,,,1,,,"<a href=""http://twitter.com/download/android"" rel=""nofollow"">Twitter for Android</a>",@Fxhedgers But Elon said COVID-19 is just like the flu...,https://twitter.com/LandJohnston/status/1240394474536210436,Fri Feb 27 20:42:21 +0000 2009,LandJohnston,false,"Love all things political and the City of Milwaukee, sustainable urban development, More Housing.",64029,1123,4987,19,"Milwaukee, WI",Land Johnston,LandJohnston,36524,,,false
,Thu Mar 19 14:20:39 +0000 2020,,,,2,1240644356668702721,,,,en,"West Haven, UT",,0,,,"<a href=""http://twitter.com/download/iphone"" rel=""nofollow"">Twitter for iPhone</a>",If you’re still saying that COVID-19 is just like the flu please look around and tell me when we’ve ever closed everything for the flu lol,https://twitter.com/mega_tron801/status/1240644356668702721,Mon Feb 01 01:10:41 +0000 2010,mega_tron801,false,"Ogden, UT. 24😝 CJZ ❤️ mommy of an angel 😇 FP @ PMTS Ogden | Artist 👩🏻‍🎨 hair stylist 💇🏼‍♀️",40361,522,635,26,"O town, Utah ",Tired,mega_tron801,35896,,,false
,Sat Mar 21 22:21:48 +0000 2020,,,,0,1241490217217011718,Diggrich_,1241488969373757400,134552828,en,,,0,,,"<a href=""http://twitter.com/download/iphone"" rel=""nofollow"">Twitter for iPhone</a>",@Diggrich_ @IllMortalDeity @King_Of_Bait @willchamberlain Show me an American physician who says we should be going abour life as if covid-19 is just like the flu.    Or who don’t agree this virus is more contagious and deadly than flu.  A practicing American physician.  Just one.  I’ll wait.,https://twitter.com/HackedVote/status/1241490217217011718,Thu May 18 13:37:56 +0000 2017,HackedVote,false,moderate left in a red state.  paid by Soros to troll you.,3811,797,2371,2,"Texas, USA",HackedVote,HackedVote,15762,,,false
